{
  "version": "1",
  "source": "Johnny's Selected Seeds succession planting guide; Cornell Cooperative Extension small-farm planting calendars; UF/IFAS Extension Florida vegetable production handbook; UC ANR Master Gardener succession planting publications; SARE Cover Crops field guide; Eliot Coleman, The New Organic Grower (succession-planting tables). Frost-anchored windows use last-spring-frost (LSF) as day 0; negative days fall before LSF and positive days after. Climate notes flag the climate types where the base window materially shifts; absence of a climate note means the base window is workable.",
  "license": "CC-BY-4.0",
  "lastUpdated": "2026-05-14",
  "entries": [
    {
      "slug": "lettuce-succession",
      "primaryCrop": "lettuce-leaf",
      "category": "continuous-harvest",
      "chains": [
        {
          "phase": 1,
          "crop": "lettuce-leaf",
          "sowMethod": "direct_sow",
          "intervalWeeks": 2,
          "startRelativeToFrost": -28,
          "endRelativeToFrost": 42,
          "climateNotes": {
            "maritime": "Season extends comfortably through June; keep sowing every 2 weeks until daytime highs cross 75F.",
            "humid_subtropical": "Bolts by mid-May; stop spring sowings around day +21 and switch to phase 2 early.",
            "arid": "Shade cloth (30 percent) extends the spring window by 2-3 weeks into early summer."
          },
          "notes": "Choose loose-leaf and Batavian types for the most heat tolerance late in the spring window."
        },
        {
          "phase": 2,
          "crop": "malabar-spinach",
          "sowMethod": "transplant",
          "intervalWeeks": null,
          "startRelativeToFrost": 42,
          "endRelativeToFrost": 120,
          "notes": "Heat-tolerant climbing substitute when lettuce bolts; one planting on a trellis fills the summer salad gap."
        },
        {
          "phase": 3,
          "crop": "lettuce-leaf",
          "sowMethod": "direct_sow",
          "intervalWeeks": 2,
          "startRelativeToFrost": 120,
          "endRelativeToFrost": 180,
          "climateNotes": {
            "maritime": "Carries into November under a low tunnel.",
            "continental": "Stop sowings 30 days before first fall frost; cold-hardy varieties (Winter Density, Rouge d'Hiver) extend by 2 weeks under row cover."
          },
          "notes": "Fall succession; pick cold-hardy varieties as the window closes."
        }
      ],
      "source": "Johnny's Selected Seeds succession guide; Cornell Cooperative Extension"
    },
    {
      "slug": "romaine-succession",
      "primaryCrop": "lettuce-romaine",
      "category": "continuous-harvest",
      "chains": [
        {
          "phase": 1,
          "crop": "lettuce-romaine",
          "sowMethod": "direct_sow",
          "intervalWeeks": 3,
          "startRelativeToFrost": -21,
          "endRelativeToFrost": 35,
          "notes": "Romaine takes longer than leaf lettuce; space sowings 3 weeks to avoid harvest pileups."
        },
        {
          "phase": 2,
          "crop": "lettuce-romaine",
          "sowMethod": "direct_sow",
          "intervalWeeks": 3,
          "startRelativeToFrost": 110,
          "endRelativeToFrost": 170,
          "climateNotes": {
            "humid_subtropical": "Best fall crop; sow weekly here, the cool season is short."
          },
          "notes": "Fall romaine often outperforms spring romaine in flavor and storage life."
        }
      ],
      "source": "Cornell Cooperative Extension; UC ANR lettuce production guide"
    },
    {
      "slug": "butterhead-succession",
      "primaryCrop": "lettuce-butterhead",
      "category": "continuous-harvest",
      "chains": [
        {
          "phase": 1,
          "crop": "lettuce-butterhead",
          "sowMethod": "transplant",
          "intervalWeeks": 2,
          "startRelativeToFrost": -21,
          "endRelativeToFrost": 28,
          "notes": "Butterheads bolt fast in heat; transplant 4-week starts every 2 weeks for steady heads."
        },
        {
          "phase": 2,
          "crop": "lettuce-butterhead",
          "sowMethod": "transplant",
          "intervalWeeks": 2,
          "startRelativeToFrost": 115,
          "endRelativeToFrost": 165,
          "climateNotes": {
            "maritime": "Mid-September transplants size up under cool fall nights for late-October harvest."
          }
        }
      ],
      "source": "Johnny's Selected Seeds succession guide; UC ANR Master Gardener publications"
    },
    {
      "slug": "spinach-succession",
      "primaryCrop": "spinach",
      "category": "continuous-harvest",
      "chains": [
        {
          "phase": 1,
          "crop": "spinach",
          "sowMethod": "direct_sow",
          "intervalWeeks": 2,
          "startRelativeToFrost": -35,
          "endRelativeToFrost": 21,
          "climateNotes": {
            "humid_subtropical": "Spring window is narrow; stop by day +7 to avoid bolting."
          },
          "notes": "Cold-tolerant; first sowings can go in as soon as soil works."
        },
        {
          "phase": 2,
          "crop": "new-zealand-spinach",
          "sowMethod": "direct_sow",
          "intervalWeeks": null,
          "startRelativeToFrost": 21,
          "endRelativeToFrost": 90,
          "notes": "Heat-tolerant cooking-greens substitute; single planting after soil reaches 60F."
        },
        {
          "phase": 3,
          "crop": "spinach",
          "sowMethod": "direct_sow",
          "intervalWeeks": 2,
          "startRelativeToFrost": 100,
          "endRelativeToFrost": 160,
          "climateNotes": {
            "continental": "Bloomsdale and Tyee overwinter under straw mulch in zone 5 and warmer."
          },
          "notes": "Fall spinach is the best spinach; pick savoyed types for cold tolerance."
        }
      ],
      "source": "Cornell Cooperative Extension; Eliot Coleman, The New Organic Grower"
    },
    {
      "slug": "arugula-succession",
      "primaryCrop": "arugula",
      "category": "continuous-harvest",
      "chains": [
        {
          "phase": 1,
          "crop": "arugula",
          "sowMethod": "direct_sow",
          "intervalWeeks": 2,
          "startRelativeToFrost": -28,
          "endRelativeToFrost": 35,
          "notes": "Cut at 4 inches before flower stalks elongate."
        },
        {
          "phase": 2,
          "crop": "arugula",
          "sowMethod": "direct_sow",
          "intervalWeeks": 2,
          "startRelativeToFrost": 105,
          "endRelativeToFrost": 165,
          "climateNotes": {
            "maritime": "Holds in the ground through December under a low tunnel."
          },
          "notes": "Summer gap is intentional; arugula goes bitter and flowers in heat above 80F."
        }
      ],
      "source": "Johnny's Selected Seeds succession guide; Cornell Cooperative Extension"
    },
    {
      "slug": "asian-greens-succession",
      "primaryCrop": "mizuna",
      "category": "continuous-harvest",
      "chains": [
        {
          "phase": 1,
          "crop": "mizuna",
          "sowMethod": "direct_sow",
          "intervalWeeks": 2,
          "startRelativeToFrost": -21,
          "endRelativeToFrost": 28,
          "notes": "Cut-and-come-again; harvest at 5 inches and the crown regrows twice."
        },
        {
          "phase": 2,
          "crop": "tatsoi",
          "sowMethod": "direct_sow",
          "intervalWeeks": 3,
          "startRelativeToFrost": 100,
          "endRelativeToFrost": 150,
          "notes": "Most cold-tolerant of the brassica greens; sweet after a frost."
        },
        {
          "phase": 3,
          "crop": "bok-choy",
          "sowMethod": "transplant",
          "intervalWeeks": 3,
          "startRelativeToFrost": 110,
          "endRelativeToFrost": 155,
          "climateNotes": {
            "humid_subtropical": "Best fall crop; spring sowings bolt before heading."
          },
          "notes": "Use small head varieties (Toy Choi) for tighter spacing."
        }
      ],
      "source": "Johnny's Selected Seeds Asian greens guide; UF/IFAS Extension"
    },
    {
      "slug": "chard-cut-and-come",
      "primaryCrop": "swiss-chard",
      "category": "continuous-harvest",
      "chains": [
        {
          "phase": 1,
          "crop": "swiss-chard",
          "sowMethod": "transplant",
          "intervalWeeks": null,
          "startRelativeToFrost": -14,
          "endRelativeToFrost": 21,
          "notes": "Single spring planting carries through summer when picked weekly from the outside in."
        },
        {
          "phase": 2,
          "crop": "swiss-chard",
          "sowMethod": "direct_sow",
          "intervalWeeks": null,
          "startRelativeToFrost": 90,
          "endRelativeToFrost": 130,
          "climateNotes": {
            "maritime": "Often overwinters; cut back hard in February and the same plant resumes.",
            "humid_subtropical": "Fall planting is the main crop; spring bolts by June."
          },
          "notes": "Second sowing for fall and overwintering."
        }
      ],
      "source": "Cornell Cooperative Extension; Eliot Coleman, The New Organic Grower"
    },
    {
      "slug": "kale-cut-and-come",
      "primaryCrop": "kale",
      "category": "continuous-harvest",
      "chains": [
        {
          "phase": 1,
          "crop": "kale",
          "sowMethod": "transplant",
          "intervalWeeks": null,
          "startRelativeToFrost": -14,
          "endRelativeToFrost": 21,
          "notes": "Spring planting; harvest from the bottom up so the crown keeps growing."
        },
        {
          "phase": 2,
          "crop": "lacinato-kale",
          "sowMethod": "direct_sow",
          "intervalWeeks": null,
          "startRelativeToFrost": 75,
          "endRelativeToFrost": 110,
          "climateNotes": {